{
  "$schema": "./guide.schema.v3.json",
  "schemaVersion": 3,
  "contentVersion": 9,
  "updatedAt": "2026-10-11T06:28:29.968433Z",
  "id": "florens-2026",
  "title": "Florens 2026",
  "destination": {
    "name": "Florens",
    "searchSuffix": "Firenze"
  },
  "timeZone": "Europe/Rome",
  "map": {
    "center": {
      "latitude": 43.7702,
      "longitude": 11.2555
    },
    "zoom": 14
  },
  "defaultSelection": {
    "id": "all",
    "label": "Ingen rutt",
    "program": [
      {
        "nodes": [
          {
            "type": "text",
            "text": "Ingen dagsrutt visas. Alla platser och kategorier finns kvar på kartan."
          }
        ]
      }
    ],
    "summary": "Utforska kartan"
  },
  "days": [
    {
      "id": "tue",
      "date": "2026-10-13",
      "label": "Tis 13",
      "routeIds": [
        "tue"
      ],
      "program": [
        {
          "nodes": [
            {
              "type": "strong",
              "text": "14.05"
            },
            {
              "type": "text",
              "text": " landning i Florens · hotellet ungefär 15.30–16.00. Därefter: upptäck Florens. "
            },
            {
              "type": "strong",
              "text": "Drink utomhus"
            },
            {
              "type": "text",
              "text": " ("
            },
            {
              "type": "place",
              "placeId": "serre-torrigiani-in-piazzetta",
              "text": "Serre Torrigiani"
            },
            {
              "type": "text",
              "text": " i första hand), sedan spontan middag i Oltrarno."
            }
          ]
        }
      ],
      "summary": "Upptäck Florens"
    },
    {
      "id": "wed",
      "date": "2026-10-14",
      "label": "Ons 14",
      "routeIds": [
        "wed"
      ],
      "program": [
        {
          "nodes": [
            {
              "type": "strong",
              "text": "11.30"
            },
            {
              "type": "text",
              "text": " "
            },
            {
              "type": "place",
              "placeId": "duomo-santa-reparata",
              "text": "Duomo / Santa Reparata"
            },
            {
              "type": "text",
              "text": " · även Baptisteriet och museet."
            }
          ]
        },
        {
          "nodes": [
            {
              "type": "strong",
              "text": "19.45"
            },
            {
              "type": "text",
              "text": " "
            },
            {
              "type": "place",
              "placeId": "cuculia",
              "text": "Cuculia"
            },
            {
              "type": "text",
              "text": " · födelsedagsmiddag."
            }
          ]
        },
        {
          "nodes": [
            {
              "type": "text",
              "text": "Santa Reparata: Porta del Campanile på södra sidan, cirka 5 minuter före bokad tid. Baptisteriet: Porta Sud. Ghiberti Pass omfattar inte kupolen eller klocktornet."
            }
          ]
        }
      ],
      "summary": "Duomo & födelsedagsmiddag"
    },
    {
      "id": "thu",
      "date": "2026-10-15",
      "label": "Tor 15",
      "routeIds": [
        "thu"
      ],
      "program": [
        {
          "nodes": [
            {
              "type": "strong",
              "text": "09.35"
            },
            {
              "type": "text",
              "text": " "
            },
            {
              "type": "place",
              "placeId": "fondazione-arte-della-seta-lisio",
              "text": "Taxi till Lisio"
            },
            {
              "type": "text",
              "text": " (ungefärlig avfärd) · "
            },
            {
              "type": "strong",
              "text": "10.15"
            },
            {
              "type": "text",
              "text": " guidad visning, räkna med upp till två timmar eller mer."
            }
          ]
        },
        {
          "nodes": [
            {
              "type": "text",
              "text": "Efteråt: taxi till "
            },
            {
              "type": "place",
              "placeId": "piazzale-michelangelo",
              "text": "Piazzale Michelangelo"
            },
            {
              "type": "text",
              "text": " för lunch i området och utsikt. Därefter besök inne i "
            },
            {
              "type": "place",
              "placeId": "san-miniato-al-monte",
              "text": "San Miniato"
            },
            {
              "type": "text",
              "text": " efter 15.30; kyrkan är stängd 13.00–15.30. Välj lunchalternativ på plats."
            }
          ]
        }
      ],
      "summary": "Siden & utsikter"
    },
    {
      "id": "fri",
      "date": "2026-10-16",
      "label": "Fre 16",
      "routeIds": [
        "fri"
      ],
      "program": [
        {
          "nodes": [
            {
              "type": "strong",
              "text": "10.30"
            },
            {
              "type": "text",
              "text": " "
            },
            {
              "type": "place",
              "placeId": "uffizierna",
              "text": "Uffizi"
            },
            {
              "type": "text",
              "text": " · därefter lunch, butiker, barer och stros mot östra centrum."
            }
          ]
        },
        {
          "nodes": [
            {
              "type": "strong",
              "text": "19.30"
            },
            {
              "type": "text",
              "text": " "
            },
            {
              "type": "place",
              "placeId": "nugolo",
              "text": "Nugolo"
            },
            {
              "type": "text",
              "text": " · promenad hem efter middagen."
            }
          ]
        }
      ],
      "summary": "Uffizi & kväll i Florens"
    },
    {
      "id": "sat",
      "date": "2026-10-17",
      "label": "Lör 17",
      "routeIds": [
        "sat"
      ],
      "program": [
        {
          "nodes": [
            {
              "type": "text",
              "text": "Fri förmiddag kring Pitti/Oltrarno, shopping och lunch."
            },
            {
              "type": "text",
              "text": " Spontant stopp om vi är i närheten: "
            },
            {
              "type": "place",
              "placeId": "giulio-giannini-e-figlio",
              "text": "Giannini e Figlio"
            },
            {
              "type": "text",
              "text": " – marmorerat papper och bokbinderi, utan bokning."
            }
          ]
        },
        {
          "nodes": [
            {
              "type": "strong",
              "text": "ca 14.15"
            },
            {
              "type": "text",
              "text": " hämta väskor · "
            },
            {
              "type": "strong",
              "text": "ca 14.45"
            },
            {
              "type": "text",
              "text": " taxi till flygplatsen · "
            },
            {
              "type": "strong",
              "text": "17.20"
            },
            {
              "type": "text",
              "text": " flyg."
            }
          ]
        }
      ],
      "summary": "Sista dagen & hemresa"
    }
  ],
  "bookings": [
    {
      "id": "duomo-santa-reparata-booking",
      "placeId": "duomo-santa-reparata",
      "startsAt": "2026-10-14T11:30:00+02:00"
    },
    {
      "id": "cuculia-booking",
      "placeId": "cuculia",
      "startsAt": "2026-10-14T19:45:00+02:00"
    },
    {
      "id": "fondazione-arte-della-seta-lisio-booking",
      "placeId": "fondazione-arte-della-seta-lisio",
      "startsAt": "2026-10-15T10:15:00+02:00"
    },
    {
      "id": "uffizierna-booking",
      "placeId": "uffizierna",
      "startsAt": "2026-10-16T10:30:00+02:00"
    },
    {
      "id": "nugolo-booking",
      "placeId": "nugolo",
      "startsAt": "2026-10-16T19:30:00+02:00"
    }
  ],
  "persistentPlaceIds": [
    "hotel-la-scaletta"
  ],
  "categories": [
    {
      "id": "booked",
      "label": "Bokat"
    },
    {
      "id": "see-do",
      "label": "Se & göra"
    },
    {
      "id": "craft",
      "label": "Hantverk"
    },
    {
      "id": "food-drink",
      "label": "Mat & dryck"
    },
    {
      "id": "shopping",
      "label": "Shopping"
    }
  ],
  "presentation": {
    "placeOverrides": {
      "hotel-la-scaletta": {
        "icon": {
          "markerColor": "red",
          "iconColor": "white",
          "icon": "home",
          "prefix": "glyphicon"
        },
        "style": "width:210px;font-family:sans-serif",
        "tooltip": false,
        "directionsUsesAddress": true,
        "mapLabel": "Öppna i Apple Kartor ↗"
      },
      "duomo-santa-reparata": {
        "icon": {
          "markerColor": "red",
          "iconColor": "white",
          "icon": "tower",
          "prefix": "glyphicon"
        },
        "style": "width:210px;font-family:sans-serif",
        "tooltip": false,
        "directionsUsesAddress": true,
        "mapLabel": "Öppna i Apple Kartor ↗"
      },
      "cuculia": {
        "icon": {
          "markerColor": "red",
          "iconColor": "white",
          "icon": "cutlery",
          "prefix": "fa"
        },
        "style": "width:210px;font-family:sans-serif",
        "tooltip": false,
        "directionsUsesAddress": true,
        "mapLabel": "Öppna i Apple Kartor ↗"
      },
      "fondazione-arte-della-seta-lisio": {
        "icon": {
          "markerColor": "red",
          "iconColor": "white",
          "icon": "scissors",
          "prefix": "fa"
        },
        "style": "width:210px;font-family:sans-serif",
        "tooltip": false,
        "directionsUsesAddress": true,
        "mapLabel": "Öppna i Apple Kartor ↗"
      },